{
  "id": "asai-2000-eyemark",
  "title": "Eye mark pointer in immersive projection display",
  "authors": [
    "K. Asai",
    "N. Osawa",
    "H. Takahashi",
    "Y. Y. Sugimoto",
    "S. Yamazaki",
    "A. Samejima",
    "T. Tanimae"
  ],
  "year": 2000,
  "venue": "IEEE Virtual Reality",
  "doi": "10.1109/vr.2000.840490",
  "url": "https://doi.org/10.1109/vr.2000.840490",
  "type": "paper",
  "citation": null,
  "bibtex": null
}
