{
  "id": "kim-2022-viewfindervr",
  "title": "ViewfinderVR: configurable viewfinder for selection of distant objects in VR",
  "authors": [
    "Woojoo Kim",
    "Shuping Xiong"
  ],
  "year": 2022,
  "venue": "Virtual Reality 26, 1573-1592",
  "doi": "10.1007/s10055-022-00649-z",
  "url": "https://doi.org/10.1007/s10055-022-00649-z",
  "type": "paper",
  "citation": null,
  "bibtex": null
}
