{
  "id": "chen-2025-assistvr",
  "title": "A Comparative Study of Speech-and-Pointing and Disocclusion Mini-Map Techniques for Object Selection in Virtual Reality",
  "authors": [
    "Junlong Chen",
    "Jens Grubert",
    "Per Ola Kristensson"
  ],
  "year": 2025,
  "venue": "ACM Symposium on Spatial User Interaction (SUI)",
  "doi": "10.1145/3694907.3765913",
  "url": "https://doi.org/10.1145/3694907.3765913",
  "type": "paper",
  "citation": null,
  "bibtex": null
}
