{
  "id": "survey2013-ref-7",
  "title": "Visual feedback techniques for virtual pointing on stereoscopic displays",
  "authors": [
    "F. Argelaguet",
    "C. Andujar"
  ],
  "year": 2009,
  "venue": "ACM VRST",
  "doi": null,
  "url": null,
  "type": "paper",
  "citation": null,
  "bibtex": null
}
