{
  "id": "stoev-2002-ttl",
  "title": "Application and Taxonomy of Through-The-Lens Techniques",
  "authors": [
    "Stanislav L. Stoev",
    "Dieter Schmalstieg"
  ],
  "year": 2002,
  "venue": "Proceedings of the ACM Symposium on Virtual Reality Software and Technology (VRST '02), 57-64",
  "doi": "10.1145/585740.585751",
  "url": "https://doi.org/10.1145/585740.585751",
  "type": "paper",
  "citation": null,
  "bibtex": null
}
