{
  "id": "vogel-2005-freehand",
  "title": "Distant Freehand Pointing and Clicking on Very Large, High Resolution Displays",
  "authors": [
    "Daniel Vogel",
    "Ravin Balakrishnan"
  ],
  "year": 2005,
  "venue": "ACM Symposium on User Interface Software and Technology (UIST)",
  "doi": "10.1145/1095034.1095041",
  "url": "https://doi.org/10.1145/1095034.1095041",
  "type": "paper",
  "citation": null,
  "bibtex": null
}
