{
  "id": "li-2021-vmirror",
  "title": "VMirror: Enhancing the Interaction with Occluded or Distant Objects in VR with Virtual Mirrors",
  "authors": [
    "Nianlong Li",
    "Zhengquan Zhang",
    "Can Liu",
    "Zengyao Yang",
    "Yinan Fu",
    "Feng Tian",
    "Teng Han",
    "Mingming Fan"
  ],
  "year": 2021,
  "venue": "CHI Conference on Human Factors in Computing Systems",
  "doi": "10.1145/3411764.3445537",
  "url": "https://doi.org/10.1145/3411764.3445537",
  "type": "paper",
  "citation": null,
  "bibtex": null
}
