{
  "id": "amini-2025",
  "title": "A Systematic Review of Fitts' Law in 3D Extended Reality",
  "authors": [
    "Mohammadreza Amini",
    "Wolfgang Stuerzlinger",
    "Robert J. Teather",
    "Anil Ufuk Batmaz"
  ],
  "year": 2025,
  "venue": "CHI Conference on Human Factors in Computing Systems",
  "doi": "10.1145/3706598.3713623",
  "url": "https://doi.org/10.1145/3706598.3713623",
  "type": "survey",
  "citation": null,
  "bibtex": null
}
