{
  "id": "stellmach-2012-looktouch",
  "title": "Look & Touch: Gaze-Supported Target Acquisition",
  "authors": [
    "Sophie Stellmach",
    "Raimund Dachselt"
  ],
  "year": 2012,
  "venue": "Proceedings of the SIGCHI Conference on Human Factors in Computing Systems (CHI '12)",
  "doi": "10.1145/2207676.2208709",
  "url": "https://doi.org/10.1145/2207676.2208709",
  "type": "paper",
  "citation": null,
  "bibtex": null
}
