{
  "id": "he-2026-predictivepursuit",
  "title": "Predictive Smooth Pursuit Gaze Interaction for Occluded Target Selection in Augmented Reality",
  "authors": [
    "He",
    "Qian",
    "Fan",
    "Niu"
  ],
  "year": 2026,
  "venue": "Displays 95, 103579",
  "doi": "10.1016/j.displa.2026.103579",
  "url": "https://doi.org/10.1016/j.displa.2026.103579",
  "type": "paper",
  "citation": null,
  "bibtex": null
}
