{
  "id": "legacy-paper-multifingerbubble",
  "title": "MultiFingerBubble: A 3D bubble cursor variation for dense environments",
  "authors": [
    "Delamare, W.",
    "Daniel, M."
  ],
  "year": 2022,
  "venue": null,
  "doi": null,
  "url": null,
  "type": "paper",
  "citation": "Delamare, W., Daniel, M., & Hasan, K. (2022, April). MultiFingerBubble: A 3D bubble cursor variation for dense environments. In CHI Conference on Human Factors in Computing Systems Extended Abstracts (pp. 1–6).",
  "bibtex": null
}
