{
  "id": "han-2026-beyondarmsreach",
  "title": "Beyond Arm's Reach: Revisiting 3D Interaction Techniques for Virtual Display Management in Immersive Workspaces",
  "authors": [
    "Dongyun Han",
    "Donghoon Kim",
    "Garrett Woodhouse",
    "Isaac Cho"
  ],
  "year": 2026,
  "venue": "IEEE Transactions on Visualization and Computer Graphics (early access)",
  "doi": "10.1109/TVCG.2026.3734382",
  "url": "https://doi.org/10.1109/TVCG.2026.3734382",
  "type": "paper",
  "citation": null,
  "bibtex": null
}
