{
  "id": "henrikson-2020-hcktm",
  "title": "Head-Coupled Kinematic Template Matching: A Prediction Model for Ray Pointing in VR",
  "authors": [
    "Rorik Henrikson",
    "Tovi Grossman",
    "Sean Trowbridge",
    "Daniel Wigdor",
    "Hrvoje Benko"
  ],
  "year": 2020,
  "venue": "Proceedings of the 2020 CHI Conference on Human Factors in Computing Systems (CHI '20)",
  "doi": "10.1145/3313831.3376489",
  "url": "https://doi.org/10.1145/3313831.3376489",
  "type": "paper",
  "citation": null,
  "bibtex": null
}
