{
  "id": "deng-2017-gazeprobe",
  "title": "Gaze Modulated Disambiguation Technique for Gesture Control in 3D Virtual Objects Selection",
  "authors": [
    "Shujie Deng",
    "Jian Chang",
    "Jian Jun Zhang",
    "Shi-Min Hu"
  ],
  "year": 2017,
  "venue": "2017 3rd IEEE International Conference on Cybernetics (CYBCONF)",
  "doi": "10.1109/CYBConf.2017.7985779",
  "url": "https://doi.org/10.1109/CYBConf.2017.7985779",
  "type": "paper",
  "citation": null,
  "bibtex": null
}
