{
  "id": "molina-2023-twostep",
  "title": "Two-step techniques for accurate selection of small elements in VR environments",
  "authors": [
    "Elena Molina",
    "Pere-Pau Vázquez"
  ],
  "year": 2023,
  "venue": "Graphical Models 128, 101183",
  "doi": "10.1016/j.gmod.2023.101183",
  "url": "https://doi.org/10.1016/j.gmod.2023.101183",
  "type": "paper",
  "citation": null,
  "bibtex": null
}
