{
  "id": "argelaguet-2009-efficient",
  "title": "Efficient 3D Pointing Selection in Cluttered Virtual Environments",
  "authors": [
    "Ferran Argelaguet",
    "Carlos Andujar"
  ],
  "year": 2009,
  "venue": "IEEE Computer Graphics and Applications 29(6), pp. 34–45",
  "doi": null,
  "url": null,
  "type": "paper",
  "citation": null,
  "bibtex": null
}
