{
  "id": "jung-2014",
  "title": "A Review on Interaction Techniques in Virtual Environments",
  "authors": [
    "Jaemoon Jung",
    "Hanjun Park",
    "Dongwook Hwang",
    "Minseok Son",
    "Donghyun Beck",
    "Juhee Park",
    "Woojin Park"
  ],
  "year": 2014,
  "venue": "Proceedings of the 2014 International Conference on Industrial Engineering and Operations Management",
  "doi": null,
  "url": null,
  "type": "survey",
  "citation": null,
  "bibtex": null
}
