{
  "id": "sidenmark-2019-eyehead",
  "title": "Eye&Head: Synergetic Eye and Head Movement for Gaze Pointing and Selection",
  "authors": [
    "Ludwig Sidenmark",
    "Hans Gellersen"
  ],
  "year": 2019,
  "venue": "ACM Symposium on User Interface Software and Technology (UIST)",
  "doi": "10.1145/3332165.3347921",
  "url": "https://doi.org/10.1145/3332165.3347921",
  "type": "paper",
  "citation": null,
  "bibtex": null
}
