{
  "id": "zhang-2022-conductor",
  "title": "Conductor: Intersection-Based Bimanual Pointing in Augmented and Virtual Reality",
  "authors": [
    "Futian Zhang",
    "Keiko Katsuragawa",
    "Edward Lank"
  ],
  "year": 2022,
  "venue": "Proceedings of the ACM on Human-Computer Interaction (ISS)",
  "doi": "10.1145/3567713",
  "url": "https://doi.org/10.1145/3567713",
  "type": "paper",
  "citation": null,
  "bibtex": null
}
