{
  "id": "pietroszek-2017-watchcasting",
  "title": "Watchcasting: Freehand 3D Interaction with Off-the-Shelf Smartwatch",
  "authors": [
    "Krzysztof Pietroszek",
    "Liudmila Tahai",
    "James R. Wallace",
    "Edward Lank"
  ],
  "year": 2017,
  "venue": "IEEE Symposium on 3D User Interfaces (3DUI)",
  "doi": "10.1109/3dui.2017.7893335",
  "url": "https://doi.org/10.1109/3dui.2017.7893335",
  "type": "paper",
  "citation": null,
  "bibtex": null
}
