{
  "id": "ramcharitar-2018-ezcursor",
  "title": "EZCursorVR: 2D Selection with Virtual Reality Head-Mounted Displays",
  "authors": [
    "Adrian Ramcharitar",
    "Robert J. Teather"
  ],
  "year": 2018,
  "venue": "Graphics Interface (GI)",
  "doi": "10.20380/gi2018.17",
  "url": "https://doi.org/10.20380/gi2018.17",
  "type": "paper",
  "citation": null,
  "bibtex": null
}
