{
  "id": "mendes-2014-midair",
  "title": "Mid-air interactions above stereoscopic interactive tables",
  "authors": [
    "Daniel Mendes",
    "Fernando Fonseca",
    "Bruno Araujo",
    "Alfredo Ferreira",
    "Joaquim Jorge"
  ],
  "year": 2014,
  "venue": "IEEE Symposium on 3D User Interfaces (3DUI)",
  "doi": "10.1109/3DUI.2014.6798833",
  "url": "https://doi.org/10.1109/3DUI.2014.6798833",
  "type": "paper",
  "citation": null,
  "bibtex": null
}
